{
  "tool": "x64-disasm-cfg",
  "version": "0.1.0",
  "mode": "recursive-descent",
  "binary": {
    "path": "corpus/tier1_straightline/pe_o0/insertion_sort.exe",
    "is_64": true,
    "image_base": 5368709120,
    "entry_va": 5368714272,
    "sections": [
      {
        "name": ".text",
        "virtual_address": 5368713216,
        "virtual_size": 6656,
        "raw_size": 6656,
        "executable": true
      },
      {
        "name": ".data",
        "virtual_address": 5368721408,
        "virtual_size": 192,
        "raw_size": 512,
        "executable": false
      },
      {
        "name": ".rdata",
        "virtual_address": 5368725504,
        "virtual_size": 2600,
        "raw_size": 3072,
        "executable": false
      },
      {
        "name": ".pdata",
        "virtual_address": 5368729600,
        "virtual_size": 564,
        "raw_size": 1024,
        "executable": false
      },
      {
        "name": ".xdata",
        "virtual_address": 5368733696,
        "virtual_size": 488,
        "raw_size": 512,
        "executable": false
      },
      {
        "name": ".bss",
        "virtual_address": 5368737792,
        "virtual_size": 384,
        "raw_size": 0,
        "executable": false
      },
      {
        "name": ".idata",
        "virtual_address": 5368741888,
        "virtual_size": 1380,
        "raw_size": 1536,
        "executable": false
      },
      {
        "name": ".tls",
        "virtual_address": 5368745984,
        "virtual_size": 16,
        "raw_size": 512,
        "executable": false
      },
      {
        "name": ".reloc",
        "virtual_address": 5368750080,
        "virtual_size": 108,
        "raw_size": 512,
        "executable": false
      },
      {
        "name": ".debug_aranges",
        "virtual_address": 5368754176,
        "virtual_size": 1264,
        "raw_size": 1536,
        "executable": false
      },
      {
        "name": ".debug_info",
        "virtual_address": 5368758272,
        "virtual_size": 46774,
        "raw_size": 47104,
        "executable": false
      },
      {
        "name": ".debug_abbrev",
        "virtual_address": 5368807424,
        "virtual_size": 8134,
        "raw_size": 8192,
        "executable": false
      },
      {
        "name": ".debug_line",
        "virtual_address": 5368815616,
        "virtual_size": 7854,
        "raw_size": 8192,
        "executable": false
      },
      {
        "name": ".debug_frame",
        "virtual_address": 5368823808,
        "virtual_size": 2264,
        "raw_size": 2560,
        "executable": false
      },
      {
        "name": ".debug_str",
        "virtual_address": 5368827904,
        "virtual_size": 707,
        "raw_size": 1024,
        "executable": false
      },
      {
        "name": ".debug_line_str",
        "virtual_address": 5368832000,
        "virtual_size": 6522,
        "raw_size": 6656,
        "executable": false
      },
      {
        "name": ".debug_loclists",
        "virtual_address": 5368840192,
        "virtual_size": 4539,
        "raw_size": 4608,
        "executable": false
      },
      {
        "name": ".debug_rnglists",
        "virtual_address": 5368848384,
        "virtual_size": 396,
        "raw_size": 512,
        "executable": false
      }
    ]
  },
  "instructions": [
    {
      "va": 5368713232,
      "len": 1,
      "bytes": "55",
      "mnemonic": "push",
      "operands": "rbp",
      "category": "data_movement",
      "flow": {
        "kind": "sequential"
      }
    },
    {
      "va": 5368713233,
      "len": 2,
      "bytes": "4157",
      "mnemonic": "push",
      "operands": "r15",
      "category": "data_movement",
      "flow": {
        "kind": "sequential"
      }
    },
    {
      "va": 5368713235,
      "len": 2,
      "bytes": "4156",
      "mnemonic": "push",
      "operands": "r14",
      "category": "data_movement",
      "flow": {
        "kind": "sequential"
      }
    },
    {
      "va": 5368713237,
      "len": 2,
      "bytes": "4155",
      "mnemonic": "push",
      "operands": "r13",
      "category": "data_movement",
      "flow": {
        "kind": "sequential"
      }
    },
    {
      "va": 5368713239,
      "len": 2,
      "bytes": "4154",
      "mnemonic": "push",
      "operands": "r12",
      "category": "data_movement",
      "flow": {
        "kind": "sequential"
      }
    },
    {
      "va": 5368713241,
      "len": 1,
      "bytes": "57",
      "mnemonic": "push",
      "operands": "rdi",
      "category": "data_movement",
      "flow": {
        "kind": "sequential"
      }
    },
    {
      "va": 5368713242,
      "len": 1,
      "bytes": "56",
      "mnemonic": "push",
      "operands": "rsi",
      "category": "data_movement",
      "flow": {
        "kind": "sequential"
      }
    },
    {
      "va": 5368713243,
      "len": 1,
      "bytes": "53",
      "mnemonic": "push",
      "operands": "rbx",
      "category": "data_movement",
      "flow": {
        "kind": "sequential"
      }
    },
    {
      "va": 5368713244,
      "len": 4,
      "bytes": "4883ec58",
      "mnemonic": "sub",
      "operands": "rsp, 0x58",
      "category": "arithmetic",
      "flow": {
        "kind": "sequential"
      }
    },
    {
      "va": 5368713248,
      "len": 5,
      "bytes": "488d6c2450",
      "mnemonic": "lea",
      "operands": "rbp, [rsp+0x50]",
      "category": "data_movement",
      "flow": {
        "kind": "sequential"
      }
    },
    {
      "va": 5368713253,
      "len": 5,
      "bytes": "b830000000",
      "mnemonic": "mov",
      "operands": "eax, 0x30",
      "category": "data_movement",
      "flow": {
        "kind": "sequential"
      }
    },
    {
      "va": 5368713258,
      "len": 5,
      "bytes": "6567488b00",
      "mnemonic": "mov",
      "operands": "rax, gs:[rax]",
      "category": "data_movement",
      "flow": {
        "kind": "sequential"
      }
    },
    {
      "va": 5368713263,
      "len": 4,
      "bytes": "488b7008",
      "mnemonic": "mov",
      "operands": "rsi, [rax+0x8]",
      "category": "data_movement",
      "flow": {
        "kind": "sequential"
      }
    },
    {
      "va": 5368713267,
      "len": 7,
      "bytes": "488b1d96340000",
      "mnemonic": "mov",
      "operands": "rbx, [rip+0x3496]",
      "category": "data_movement",
      "flow": {
        "kind": "sequential"
      }
    },
    {
      "va": 5368713274,
      "len": 7,
      "bytes": "488b3d67710000",
      "mnemonic": "mov",
      "operands": "rdi, [rip+0x7167]",
      "category": "data_movement",
      "flow": {
        "kind": "sequential"
      }
    },
    {
      "va": 5368713281,
      "len": 2,
      "bytes": "eb15",
      "mnemonic": "jmp",
      "operands": "0x140001058",
      "category": "control_flow",
      "flow": {
        "kind": "jump",
        "target": 5368713304
      }
    },
    {
      "va": 5368713304,
      "len": 2,
      "bytes": "31c0",
      "mnemonic": "xor",
      "operands": "eax, eax",
      "category": "arithmetic",
      "flow": {
        "kind": "sequential"
      }
    },
    {
      "va": 5368714272,
      "len": 1,
      "bytes": "55",
      "mnemonic": "push",
      "operands": "rbp",
      "category": "data_movement",
      "flow": {
        "kind": "sequential"
      }
    },
    {
      "va": 5368714273,
      "len": 3,
      "bytes": "4889e5",
      "mnemonic": "mov",
      "operands": "rbp, rsp",
      "category": "data_movement",
      "flow": {
        "kind": "sequential"
      }
    },
    {
      "va": 5368714276,
      "len": 4,
      "bytes": "4883ec20",
      "mnemonic": "sub",
      "operands": "rsp, 0x20",
      "category": "arithmetic",
      "flow": {
        "kind": "sequential"
      }
    },
    {
      "va": 5368714280,
      "len": 7,
      "bytes": "488b0551300000",
      "mnemonic": "mov",
      "operands": "rax, [rip+0x3051]",
      "category": "data_movement",
      "flow": {
        "kind": "sequential"
      }
    },
    {
      "va": 5368714287,
      "len": 6,
      "bytes": "c70000000000",
      "mnemonic": "mov",
      "operands": "[rax], 0x0",
      "category": "data_movement",
      "flow": {
        "kind": "sequential"
      }
    },
    {
      "va": 5368714293,
      "len": 5,
      "bytes": "e8d6fbffff",
      "mnemonic": "call",
      "operands": "0x140001010",
      "category": "control_flow",
      "flow": {
        "kind": "call",
        "target": 5368713232
      }
    },
    {
      "va": 5368714298,
      "len": 1,
      "bytes": "90",
      "mnemonic": "nop",
      "operands": "",
      "category": "other",
      "flow": {
        "kind": "sequential"
      }
    },
    {
      "va": 5368714299,
      "len": 1,
      "bytes": "90",
      "mnemonic": "nop",
      "operands": "",
      "category": "other",
      "flow": {
        "kind": "sequential"
      }
    },
    {
      "va": 5368714300,
      "len": 4,
      "bytes": "4883c420",
      "mnemonic": "add",
      "operands": "rsp, 0x20",
      "category": "arithmetic",
      "flow": {
        "kind": "sequential"
      }
    },
    {
      "va": 5368714304,
      "len": 1,
      "bytes": "5d",
      "mnemonic": "pop",
      "operands": "rbp",
      "category": "data_movement",
      "flow": {
        "kind": "sequential"
      }
    },
    {
      "va": 5368714305,
      "len": 1,
      "bytes": "c3",
      "mnemonic": "ret",
      "operands": "",
      "category": "control_flow",
      "flow": {
        "kind": "return"
      }
    },
    {
      "va": 5368714320,
      "len": 5,
      "bytes": "e9e3140000",
      "mnemonic": "jmp",
      "operands": "0x140002938",
      "category": "control_flow",
      "flow": {
        "kind": "jump",
        "target": 5368719672
      }
    },
    {
      "va": 5368714368,
      "len": 1,
      "bytes": "55",
      "mnemonic": "push",
      "operands": "rbp",
      "category": "data_movement",
      "flow": {
        "kind": "sequential"
      }
    },
    {